{
  "$schema": "https://json-schema.org/draft/2020-12/schema",
  "$id": "https://newfold-labs.github.io/standards/schema/scorecard.schema.json",
  "title": "Newfold Labs standards scorecard",
  "description": "The org sweep's output, read by the site at build time and published alongside it so other tooling can consume the same data. Validated in CI before the site builds; an invalid scorecard fails the build rather than rendering a wrong board.",
  "type": "object",
  "additionalProperties": false,
  "required": ["schema", "generated_at", "org", "policy_fingerprint", "levels", "signals", "rules", "summary", "repos"],
  "properties": {
    "schema": {
      "description": "Payload version. Bumped when a consumer would have to change to keep reading this file.",
      "const": 1
    },
    "generated_at": {
      "description": "When the sweep ran, ISO 8601. The board shows this so a stale board is visibly stale.",
      "type": "string",
      "format": "date-time"
    },
    "org": { "type": "string", "minLength": 1 },
    "policy_fingerprint": {
      "description": "Hash of the rules and levels every row was scored under. A change invalidates every stored row, which is what makes the incremental sweep safe.",
      "type": "string",
      "minLength": 8
    },
    "levels": {
      "type": "array",
      "minItems": 2,
      "items": {
        "type": "object",
        "required": ["level", "id", "title", "summary", "requires"],
        "properties": {
          "level": { "type": "integer", "minimum": 0 },
          "id": { "type": "string", "pattern": "^[a-z0-9]+(-[a-z0-9]+)*$" },
          "title": { "type": "string", "minLength": 3 },
          "summary": { "type": "string", "minLength": 3 },
          "requires": { "type": "array", "items": { "type": "string" } }
        }
      }
    },
    "signals": {
      "type": "array",
      "items": {
        "type": "object",
        "required": ["id", "title", "detail"],
        "properties": {
          "id": { "type": "string", "pattern": "^[a-z0-9]+(_[a-z0-9]+)*$" },
          "title": { "type": "string", "minLength": 3 },
          "detail": { "type": "string", "minLength": 10 },
          "read": { "type": "string" }
        }
      }
    },
    "rules": {
      "type": "array",
      "items": {
        "type": "object",
        "required": ["id", "standard", "title", "severity", "applies_to"],
        "properties": {
          "id": { "type": "string", "pattern": "^[a-z0-9]+(-[a-z0-9]+)*$" },
          "standard": { "type": "string", "minLength": 3 },
          "title": { "type": "string", "minLength": 3 },
          "severity": { "enum": ["error", "warning"] },
          "engine": { "type": ["string", "null"] },
          "applies_to": {
            "type": "array",
            "items": { "enum": ["any", "plugin", "theme", "module", "worker", "service"] }
          },
          "package": { "type": ["string", "null"] },
          "introduced_in": { "type": ["string", "null"] }
        }
      }
    },
    "package_versions": {
      "description": "Latest release of each package a rule names, read at sweep time. Writing a current version down anywhere would make it wrong the day after the next release.",
      "type": "object",
      "additionalProperties": { "type": "string" }
    },
    "summary": {
      "type": "object",
      "required": ["repos", "reporting", "findings", "by_level", "by_rule"],
      "properties": {
        "repos": { "type": "integer", "minimum": 0 },
        "reporting": { "type": "integer", "minimum": 0 },
        "findings": { "type": "integer", "minimum": 0 },
        "by_level": { "type": "object", "additionalProperties": { "type": "integer" } },
        "by_type": { "type": "object" },
        "by_rule": { "type": "object" }
      }
    },
    "repos": {
      "type": "array",
      "items": {
        "type": "object",
        "additionalProperties": false,
        "required": ["name", "url", "private", "artifact_type", "level", "signals", "rules"],
        "properties": {
          "name": { "type": "string", "minLength": 1 },
          "url": { "type": "string", "format": "uri" },
          "private": { "type": "boolean" },
          "artifact_type": { "enum": ["plugin", "theme", "module", "worker", "service"] },
          "language": { "type": ["string", "null"] },
          "pushed_at": { "type": ["string", "null"] },
          "level": { "type": "integer", "minimum": 0 },
          "signals": {
            "description": "Each signal is true, false, or null. Null means we could not tell, which is not the same as false and must not be rendered as one.",
            "type": "object",
            "additionalProperties": { "type": ["boolean", "null"] }
          },
          "rules": {
            "type": "object",
            "additionalProperties": { "enum": ["pass", "fail", "ineligible", "unknown", "not_applicable"] }
          },
          "finding_count": { "type": "integer", "minimum": 0 },
          "error_count": { "type": "integer", "minimum": 0 },
          "reported_at": { "type": ["string", "null"] }
        }
      }
    }
  }
}
