{
	"schema": 1,
	"generated_at": "2026-08-21T08:55:15.417Z",
	"org": "newfold-labs",
	"policy_fingerprint": "90e06236aeed6f31",
	"levels": [
		{
			"level": 0,
			"id": "unadopted",
			"title": "Not adopted",
			"summary": "Nothing here enforces a standard yet",
			"requires": []
		},
		{
			"level": 1,
			"id": "configured",
			"title": "Configured",
			"summary": "The enforcing package is installed, so the checks can run",
			"requires": [
				"standards_package_present"
			]
		},
		{
			"level": 2,
			"id": "reporting",
			"title": "Reporting",
			"summary": "The check runs in the repository's own CI and publishes what it found",
			"requires": [
				"check_reports"
			]
		},
		{
			"level": 3,
			"id": "clean",
			"title": "Clean",
			"summary": "Nothing outstanding at error severity",
			"requires": [
				"no_error_findings"
			]
		},
		{
			"level": 4,
			"id": "current",
			"title": "Current",
			"summary": "On the current release, owned, and readable by AI tooling",
			"requires": [
				"standards_package_current",
				"has_codeowners",
				"has_ai_context"
			]
		}
	],
	"signals": [
		{
			"id": "standards_package_present",
			"title": "Installs the standards package",
			"detail": "composer.json requires newfold-labs/wp-php-standards, for artifact types that have a PHP standard. Types with no PHP standard yet satisfy this trivially rather than failing a check that does not exist for them.",
			"read": "composer.json"
		},
		{
			"id": "standards_package_current",
			"title": "Pinned to the current release",
			"detail": "The declared constraint admits the latest release of the package. A constraint that cannot reach the current version is what stops a repository from ever running a newly added rule, so it is the signal that gates the top of the ladder.",
			"read": "composer.json"
		},
		{
			"id": "check_reports",
			"title": "Reports compliance from its own CI",
			"detail": "The repository has uploaded a standards-compliance artifact. This is the definition of adoption: the sweep never runs a linter itself, so a repository that does not report is one we have no findings for.",
			"read": "actions artifact"
		},
		{
			"id": "no_error_findings",
			"title": "No findings at error severity",
			"detail": "The reported findings contain nothing at error severity. Warnings do not block a level. Under our severity policy an error means the code cannot parse, so this is a real gate rather than a tidiness one.",
			"read": "standards-compliance artifact"
		},
		{
			"id": "has_codeowners",
			"title": "Has an owner",
			"detail": "CODEOWNERS exists and is not empty. A row nobody owns is a row nobody fixes, which is why ownership is a level and not a footnote.",
			"read": ".github/CODEOWNERS"
		},
		{
			"id": "has_ai_context",
			"title": "Carries AI context",
			"detail": "AGENTS.md exists, so AI tooling working in the repository can reach the standards rather than guessing at them.",
			"read": "AGENTS.md"
		}
	],
	"rules": [
		{
			"id": "wp-hooks-naming-hook-name-format",
			"standard": "wp-hooks-naming",
			"title": "Hooks are fired as newfold/[context]/[action|filter]/[name]",
			"severity": "warning",
			"engine": "phpcs",
			"applies_to": [
				"plugin",
				"theme",
				"module"
			],
			"package": "newfold-labs/wp-php-standards",
			"introduced_in": "2.0.0"
		},
		{
			"id": "wp-php-namespace-format",
			"standard": "wp-php",
			"title": "Declared namespaces start with NewfoldLabs\\WP\\{Plugin|Theme|Module}\\{Name}",
			"severity": "warning",
			"engine": "phpcs",
			"applies_to": [
				"plugin",
				"theme",
				"module"
			],
			"package": "newfold-labs/wp-php-standards",
			"introduced_in": "2.0.0"
		}
	],
	"package_versions": {
		"newfold-labs/wp-php-standards": "2.0.0"
	},
	"summary": {
		"repos": 125,
		"reporting": 0,
		"findings": 0,
		"by_level": {
			"0": 13,
			"1": 112,
			"2": 0,
			"3": 0,
			"4": 0
		},
		"by_type": {
			"worker": {
				"repos": 36,
				"levels": {
					"1": 36
				}
			},
			"module": {
				"repos": 49,
				"levels": {
					"0": 6,
					"1": 43
				}
			},
			"plugin": {
				"repos": 39,
				"levels": {
					"0": 6,
					"1": 33
				}
			},
			"theme": {
				"repos": 1,
				"levels": {
					"0": 1
				}
			}
		},
		"by_rule": {
			"wp-hooks-naming-hook-name-format": {
				"pass": 0,
				"fail": 0,
				"ineligible": 83,
				"unknown": 6,
				"not_applicable": 36
			},
			"wp-php-namespace-format": {
				"pass": 0,
				"fail": 0,
				"ineligible": 83,
				"unknown": 6,
				"not_applicable": 36
			}
		}
	},
	"repos": [
		{
			"name": "cf-worker-ai-chat",
			"url": "https://github.com/newfold-labs/cf-worker-ai-chat",
			"private": true,
			"artifact_type": "worker",
			"language": "TypeScript",
			"pushed_at": "2026-08-19T11:00:09Z",
			"level": 1,
			"signals": {
				"standards_package_present": true,
				"standards_package_current": null,
				"check_reports": false,
				"no_error_findings": null,
				"has_codeowners": false,
				"has_ai_context": false
			},
			"rules": {
				"wp-hooks-naming-hook-name-format": "not_applicable",
				"wp-php-namespace-format": "not_applicable"
			},
			"finding_count": 0,
			"error_count": 0,
			"reported_at": null
		},
		{
			"name": "cf-worker-ai-image-generation",
			"url": "https://github.com/newfold-labs/cf-worker-ai-image-generation",
			"private": true,
			"artifact_type": "worker",
			"language": "JavaScript",
			"pushed_at": "2026-06-23T03:29:47Z",
			"level": 1,
			"signals": {
				"standards_package_present": true,
				"standards_package_current": null,
				"check_reports": false,
				"no_error_findings": null,
				"has_codeowners": false,
				"has_ai_context": false
			},
			"rules": {
				"wp-hooks-naming-hook-name-format": "not_applicable",
				"wp-php-namespace-format": "not_applicable"
			},
			"finding_count": 0,
			"error_count": 0,
			"reported_at": null
		},
		{
			"name": "cf-worker-ai-proxy",
			"url": "https://github.com/newfold-labs/cf-worker-ai-proxy",
			"private": true,
			"artifact_type": "worker",
			"language": "JavaScript",
			"pushed_at": "2026-06-23T03:32:47Z",
			"level": 1,
			"signals": {
				"standards_package_present": true,
				"standards_package_current": null,
				"check_reports": false,
				"no_error_findings": null,
				"has_codeowners": false,
				"has_ai_context": false
			},
			"rules": {
				"wp-hooks-naming-hook-name-format": "not_applicable",
				"wp-php-namespace-format": "not_applicable"
			},
			"finding_count": 0,
			"error_count": 0,
			"reported_at": null
		},
		{
			"name": "cf-worker-ai-sitegen",
			"url": "https://github.com/newfold-labs/cf-worker-ai-sitegen",
			"private": true,
			"artifact_type": "worker",
			"language": "JavaScript",
			"pushed_at": "2026-06-24T07:56:14Z",
			"level": 1,
			"signals": {
				"standards_package_present": true,
				"standards_package_current": null,
				"check_reports": false,
				"no_error_findings": null,
				"has_codeowners": false,
				"has_ai_context": false
			},
			"rules": {
				"wp-hooks-naming-hook-name-format": "not_applicable",
				"wp-php-namespace-format": "not_applicable"
			},
			"finding_count": 0,
			"error_count": 0,
			"reported_at": null
		},
		{
			"name": "cf-worker-cache-preload",
			"url": "https://github.com/newfold-labs/cf-worker-cache-preload",
			"private": true,
			"artifact_type": "worker",
			"language": "JavaScript",
			"pushed_at": "2026-05-14T23:23:14Z",
			"level": 1,
			"signals": {
				"standards_package_present": true,
				"standards_package_current": null,
				"check_reports": false,
				"no_error_findings": null,
				"has_codeowners": false,
				"has_ai_context": false
			},
			"rules": {
				"wp-hooks-naming-hook-name-format": "not_applicable",
				"wp-php-namespace-format": "not_applicable"
			},
			"finding_count": 0,
			"error_count": 0,
			"reported_at": null
		},
		{
			"name": "cf-worker-content-gen-proxy",
			"url": "https://github.com/newfold-labs/cf-worker-content-gen-proxy",
			"private": true,
			"artifact_type": "worker",
			"language": "JavaScript",
			"pushed_at": "2026-05-15T03:20:41Z",
			"level": 1,
			"signals": {
				"standards_package_present": true,
				"standards_package_current": null,
				"check_reports": false,
				"no_error_findings": null,
				"has_codeowners": false,
				"has_ai_context": false
			},
			"rules": {
				"wp-hooks-naming-hook-name-format": "not_applicable",
				"wp-php-namespace-format": "not_applicable"
			},
			"finding_count": 0,
			"error_count": 0,
			"reported_at": null
		},
		{
			"name": "cf-worker-content-tones",
			"url": "https://github.com/newfold-labs/cf-worker-content-tones",
			"private": true,
			"artifact_type": "worker",
			"language": "JavaScript",
			"pushed_at": "2026-05-15T03:13:18Z",
			"level": 1,
			"signals": {
				"standards_package_present": true,
				"standards_package_current": null,
				"check_reports": false,
				"no_error_findings": null,
				"has_codeowners": false,
				"has_ai_context": false
			},
			"rules": {
				"wp-hooks-naming-hook-name-format": "not_applicable",
				"wp-php-namespace-format": "not_applicable"
			},
			"finding_count": 0,
			"error_count": 0,
			"reported_at": null
		},
		{
			"name": "cf-worker-event-ingest",
			"url": "https://github.com/newfold-labs/cf-worker-event-ingest",
			"private": true,
			"artifact_type": "worker",
			"language": "TypeScript",
			"pushed_at": "2026-07-30T17:37:54Z",
			"level": 1,
			"signals": {
				"standards_package_present": true,
				"standards_package_current": null,
				"check_reports": false,
				"no_error_findings": null,
				"has_codeowners": false,
				"has_ai_context": true
			},
			"rules": {
				"wp-hooks-naming-hook-name-format": "not_applicable",
				"wp-php-namespace-format": "not_applicable"
			},
			"finding_count": 0,
			"error_count": 0,
			"reported_at": null
		},
		{
			"name": "cf-worker-event-process",
			"url": "https://github.com/newfold-labs/cf-worker-event-process",
			"private": true,
			"artifact_type": "worker",
			"language": "TypeScript",